[
  {
    "id": "dark-matter",
    "title": {
      "es": "Materia Oscura",
      "en": "Dark Matter"
    },
    "short_description": {
      "es": "Modelado de halos, simulaciones N-cuerpo y restricciones observacionales sobre la naturaleza de la materia oscura.",
      "en": "Halo modelling, N-body simulations, and observational constraints on the nature of dark matter."
    },
    "full_description": {
      "es": "La materia oscura constituye aproximadamente el 27% del contenido energético total del universo, pero su naturaleza fundamental permanece como uno de los grandes enigmas de la física moderna. Nuestro grupo investiga la distribución y estructura de halos de materia oscura mediante simulaciones numéricas de N-cuerpos y modelos analíticos derivados de la teoría de perturbaciones.\n\nAplicamos técnicas estadísticas avanzadas para extraer restricciones observacionales a partir de datos de lentes gravitacionales débiles, correlaciones de galaxias y la función de masa de cúmulos. Colaboramos activamente con grupos observacionales del IAFE y del Observatorio Astronómico de Córdoba para contrastar nuestras predicciones teóricas con relevamientos fotométricos y espectroscópicos de gran escala.\n\nEntre nuestros objetivos actuales se encuentran el estudio de la concentración de halos en función de la masa y el corrimiento al rojo, y la búsqueda de señales de materia oscura tibia que podrían revelar desviaciones respecto al modelo Lambda-CDM estándar.",
      "en": "Dark matter constitutes approximately 27% of the total energy content of the universe, yet its fundamental nature remains one of the great open questions in modern physics. Our group investigates the distribution and structure of dark matter halos through N-body numerical simulations and analytical models derived from perturbation theory.\n\nWe apply advanced statistical techniques to extract observational constraints from weak gravitational lensing data, galaxy correlations, and cluster mass functions. We actively collaborate with observational groups at IAFE and the Observatorio Astronomico de Cordoba to confront our theoretical predictions with large-scale photometric and spectroscopic surveys.\n\nAmong our current goals are the study of halo concentration as a function of mass and redshift, and the search for warm dark matter signatures that could reveal deviations from the standard Lambda-CDM model."
    },
    "icon": "atom",
    "order": 0
  },
  {
    "id": "gravitational-waves",
    "title": {
      "es": "Ondas Gravitacionales",
      "en": "Gravitational Waves"
    },
    "short_description": {
      "es": "Análisis de fuentes astrofísicas de ondas gravitacionales y sus contrapartes electromagnéticas en el contexto cosmológico.",
      "en": "Analysis of astrophysical gravitational-wave sources and their electromagnetic counterparts in a cosmological context."
    },
    "full_description": {
      "es": "La detección directa de ondas gravitacionales por LIGO y Virgo abrió una nueva ventana observacional al universo. Nuestro grupo trabaja en la modelización teórica de fuentes compactas binarias — pares de agujeros negros y estrellas de neutrones — con énfasis en los aspectos cosmológicos de sus señales: la determinación independiente de la constante de Hubble mediante sirenas estándar y la extracción de información sobre la historia de formación estelar.\n\nEstudiamos también el fondo estocástico de ondas gravitacionales producido por procesos del universo temprano, como transiciones de fase de primer orden y redes de defectos topológicos. Este fondo podría detectarse con futuros observatorios espaciales como LISA y constituye un complemento único a las observaciones de la radiación cósmica de fondo.\n\nColaboramos con el grupo de astrofísica relativista de la UBA y con equipos de análisis de datos de la colaboración LIGO-Virgo-KAGRA para el estudio de parámetros poblacionales de fuentes detectadas.",
      "en": "The direct detection of gravitational waves by LIGO and Virgo opened a new observational window to the universe. Our group works on the theoretical modelling of compact binary sources — pairs of black holes and neutron stars — with emphasis on the cosmological aspects of their signals: the independent determination of the Hubble constant via standard sirens and the extraction of information about stellar formation history.\n\nWe also study the stochastic gravitational-wave background produced by early-universe processes, such as first-order phase transitions and networks of topological defects. This background could be detected by future space observatories such as LISA and constitutes a unique complement to observations of the cosmic microwave background.\n\nWe collaborate with the relativistic astrophysics group at UBA and with data analysis teams of the LIGO-Virgo-KAGRA collaboration for the study of population parameters of detected sources."
    },
    "icon": "waves",
    "order": 1
  },
  {
    "id": "early-universe",
    "title": {
      "es": "Universo Temprano",
      "en": "Early Universe"
    },
    "short_description": {
      "es": "Inflación cosmológica, nucleosíntesis primordial y formación de estructura en las primeras épocas del universo.",
      "en": "Cosmic inflation, primordial nucleosynthesis, and structure formation in the earliest epochs of the universe."
    },
    "full_description": {
      "es": "El universo temprano, desde la era de Planck hasta la recombinación, es el laboratorio natural para la física de altas energías más allá del Modelo Estándar. Nuestro grupo estudia la dinámica inflacionaria y sus predicciones para el espectro de potencias de las perturbaciones primordiales, con énfasis en modelos de campo escalar motivados por supergravedad y teoría de cuerdas.\n\nAbordamos también la nucleosíntesis primordial como sonda de la física del neutrino y de la asimetría bariónica, contrastando predicciones con las abundancias observadas de hidrógeno, deuterio y helio en objetos primitivos. El estudio de la radiación cósmica de fondo en microondas (CMB), en particular sus anisotropías de temperatura y polarización, provee las restricciones más precisas sobre los parámetros cosmológicos fundamentales.\n\nNuestro interés se extiende a fenómenos no perturbativos del universo temprano: transiciones de fase cosmológicas, producción de defectos topológicos y el mecanismo de bariogénesis, todos ellos con potenciales huellas observacionales en el espectro de ondas gravitacionales de fondo.",
      "en": "The early universe, from the Planck era to recombination, is the natural laboratory for high-energy physics beyond the Standard Model. Our group studies inflationary dynamics and its predictions for the power spectrum of primordial perturbations, with emphasis on scalar field models motivated by supergravity and string theory.\n\nWe also address primordial nucleosynthesis as a probe of neutrino physics and baryon asymmetry, confronting predictions with the observed abundances of hydrogen, deuterium, and helium in pristine objects. The study of the cosmic microwave background (CMB), in particular its temperature and polarisation anisotropies, provides the most precise constraints on fundamental cosmological parameters.\n\nOur interest extends to non-perturbative phenomena of the early universe: cosmological phase transitions, the production of topological defects, and the baryogenesis mechanism, all of which leave potential observational imprints in the stochastic gravitational-wave spectrum."
    },
    "icon": "sparkles",
    "order": 2
  },
  {
    "id": "artificial-intelligence",
    "title": {
      "es": "Inteligencia Artificial y Cosmología",
      "en": "Artificial Intelligence and Cosmology"
    },
    "short_description": {
      "es": "Aplicación de métodos de aprendizaje automático y redes neuronales a problemas de cosmología observacional y análisis de datos astronómicos.",
      "en": "Application of machine learning methods and neural networks to problems in observational cosmology and astronomical data analysis."
    },
    "full_description": {
      "es": "El volumen y la complejidad de los datos generados por relevamientos modernos como DESI, Rubin LSST y Euclid exigen nuevas herramientas de análisis que van más allá de los métodos estadísticos clásicos. Nuestro grupo explora la aplicación de técnicas de aprendizaje profundo — redes convolucionales, transformers y modelos generativos — para la clasificación de galaxias, la estimación de corrimientos al rojo fotométricos y la detección de lentes gravitacionales en imágenes de gran escala.\n\nDesarrollamos también métodos de inferencia basados en simulaciones (simulation-based inference, SBI) que permiten extraer parámetros cosmológicos directamente de los datos crudos sin necesidad de estadísticos resumen comprimidos. Estos enfoques son especialmente potentes en presencia de efectos sistemáticos complejos o cuando la función de verosimilitud analítica es intratable.\n\nNuestro trabajo en IA se integra con las líneas de investigación en materia oscura y universo temprano, proporcionando herramientas de análisis que aceleran el ciclo predicción-observación-restricción en cosmología de precisión.",